{
  "slug": "render-chatgpt-chat",
  "category": "capabilities",
  "domain": "ads",
  "tags": [
    "ads"
  ],
  "installation": {
    "base_command": "npx goose-skills install render-chatgpt-chat",
    "supports": [
      "claude",
      "cursor",
      "codex"
    ]
  },
  "requires_skills": [
    "watch"
  ]
}
