{
  "slug": "remix-graphic-ad-from-reference",
  "category": "composites",
  "domain": "ads",
  "tags": ["ads", "design"],
  "installation": {
    "base_command": "npx goose-skills install remix-graphic-ad-from-reference",
    "supports": ["claude", "cursor", "codex"]
  },
  "requires_skills": [
    "goose-graphics",
    "create-image-gpt-image-fal",
    "verify-product-image",
    "brand-research"
  ]
}
